{
  "schemaVersion": "1",
  "observationsHash": "sha256:ccbf481ca2a77d1613abe75a07b8cfa8954d4b3b65db0331984cf1aa7aa87b56",
  "builderHash": "sha256:470d14ce147c9a78666ae51a50697d887ddb4fdc270c4a9d6c9a56e227e58494",
  "role": "history",
  "records": [
    {
      "unitId": "history-a",
      "cutoff": 4,
      "events": [
        {
          "time": 0,
          "value": "sha256:262928fcee43218330ae13c92801e92ce05671705819116b4d5ec17102715544"
        },
        {
          "time": 1,
          "value": "sha256:d6df79d596f562d107cfa22a69eb43aa4eeb08cdd3836689c322b486c91eb214"
        },
        {
          "time": 2,
          "value": "sha256:0f454df44b1c6186a057f9b6a11c47b8d0889d470c087d9624713fecea506bb6"
        },
        {
          "time": 3,
          "value": "sha256:7226df1a93f83acca781885dc496c5e3f24355bbc061ac2c9b8f416b17a32a1d"
        }
      ]
    },
    {
      "unitId": "history-b",
      "cutoff": 2,
      "events": [
        {
          "time": 0,
          "value": "sha256:d6df79d596f562d107cfa22a69eb43aa4eeb08cdd3836689c322b486c91eb214"
        },
        {
          "time": 1,
          "value": "sha256:7226df1a93f83acca781885dc496c5e3f24355bbc061ac2c9b8f416b17a32a1d"
        }
      ]
    },
    {
      "unitId": "history-grouped",
      "cutoff": 1,
      "events": [
        {
          "time": 0,
          "value": "sha256:826b021ba2893a802ab0cf9d723920929d882224c6e7589a2811ce9b0cbf9c60"
        }
      ]
    },
    {
      "unitId": "history-redundant",
      "cutoff": 5,
      "events": [
        {
          "time": 0,
          "value": "sha256:71c851dfd12f01a3e3a21e3939ae442182b687a208066132c025dac4a490b728"
        },
        {
          "time": 1,
          "value": "sha256:d6df79d596f562d107cfa22a69eb43aa4eeb08cdd3836689c322b486c91eb214"
        },
        {
          "time": 2,
          "value": "sha256:de05091279b558cff5dbf30d7fdf8ba88305a42bca4f1b2abb1391ab6ca18db0"
        },
        {
          "time": 3,
          "value": "sha256:603a1a106f5a42cfe6c72c2f4de2d9b3b5c7c3ba2ac62994a8e54d8b35cdae57"
        },
        {
          "time": 4,
          "value": "sha256:7226df1a93f83acca781885dc496c5e3f24355bbc061ac2c9b8f416b17a32a1d"
        }
      ]
    }
  ],
  "hash": "sha256:2b8348fac0ff49a4ba8886f8c2fdda6ae33ee199a7b52c4077ac7855f7b8235e"
}
