{
  "schemaVersion": "1",
  "observationsHash": "sha256:2dfa8d49b9c4d1f740fe2e982d4a5820e176ddfd0c94598ffa59f13e9ca5f86b",
  "builderHash": "sha256:470d14ce147c9a78666ae51a50697d887ddb4fdc270c4a9d6c9a56e227e58494",
  "role": "history",
  "records": [
    {
      "unitId": "history-a",
      "cutoff": 1,
      "events": [
        {
          "time": 0,
          "value": "{\"ancestry\":[{\"oid\":\"a97c3b6c4cf2eb42ed931917446b0dcf61afbc8d\",\"parentOids\":[]},{\"oid\":\"b970c7437b945bb9af6f0569b09f562f282b5f31\",\"parentOids\":[\"a97c3b6c4cf2eb42ed931917446b0dcf61afbc8d\"]}],\"parents\":[\"b970c7437b945bb9af6f0569b09f562f282b5f31\"]}"
        }
      ]
    },
    {
      "unitId": "history-b",
      "cutoff": 1,
      "events": [
        {
          "time": 0,
          "value": "{\"ancestry\":[{\"oid\":\"01bb1af009bf8b0259a17b12e28ea0369c3bfdd3\",\"parentOids\":[\"15195716cfbd2d27aeaa9fdfa6b960627cde9036\"]},{\"oid\":\"15195716cfbd2d27aeaa9fdfa6b960627cde9036\",\"parentOids\":[]}],\"parents\":[\"01bb1af009bf8b0259a17b12e28ea0369c3bfdd3\"]}"
        }
      ]
    },
    {
      "unitId": "history-c",
      "cutoff": 1,
      "events": [
        {
          "time": 0,
          "value": "{\"ancestry\":[{\"oid\":\"096ff95f00916c4d3262d202441d482d9a249bae\",\"parentOids\":[\"9f050f8023667f8f4b7e6c017811ee0bceae9a39\"]},{\"oid\":\"9f050f8023667f8f4b7e6c017811ee0bceae9a39\",\"parentOids\":[\"a97c3b6c4cf2eb42ed931917446b0dcf61afbc8d\"]},{\"oid\":\"a97c3b6c4cf2eb42ed931917446b0dcf61afbc8d\",\"parentOids\":[]}],\"parents\":[\"096ff95f00916c4d3262d202441d482d9a249bae\"]}"
        }
      ]
    },
    {
      "unitId": "history-linear",
      "cutoff": 1,
      "events": [
        {
          "time": 0,
          "value": "{\"ancestry\":[{\"oid\":\"a97c3b6c4cf2eb42ed931917446b0dcf61afbc8d\",\"parentOids\":[]},{\"oid\":\"d6b34a38665ef7fcbd80c58cbbe95f1aa9f45f28\",\"parentOids\":[\"a97c3b6c4cf2eb42ed931917446b0dcf61afbc8d\"]}],\"parents\":[\"d6b34a38665ef7fcbd80c58cbbe95f1aa9f45f28\"]}"
        }
      ]
    },
    {
      "unitId": "history-merge",
      "cutoff": 1,
      "events": [
        {
          "time": 0,
          "value": "{\"ancestry\":[{\"oid\":\"59347e74b816dfe9ec6ce1d18f42d840b08e7e97\",\"parentOids\":[\"a97c3b6c4cf2eb42ed931917446b0dcf61afbc8d\"]},{\"oid\":\"a97c3b6c4cf2eb42ed931917446b0dcf61afbc8d\",\"parentOids\":[]},{\"oid\":\"d6b34a38665ef7fcbd80c58cbbe95f1aa9f45f28\",\"parentOids\":[\"a97c3b6c4cf2eb42ed931917446b0dcf61afbc8d\"]}],\"parents\":[\"d6b34a38665ef7fcbd80c58cbbe95f1aa9f45f28\",\"59347e74b816dfe9ec6ce1d18f42d840b08e7e97\"]}"
        }
      ]
    },
    {
      "unitId": "history-metadata",
      "cutoff": 1,
      "events": [
        {
          "time": 0,
          "value": "{\"ancestry\":[{\"oid\":\"a97c3b6c4cf2eb42ed931917446b0dcf61afbc8d\",\"parentOids\":[]},{\"oid\":\"b970c7437b945bb9af6f0569b09f562f282b5f31\",\"parentOids\":[\"a97c3b6c4cf2eb42ed931917446b0dcf61afbc8d\"]}],\"parents\":[\"b970c7437b945bb9af6f0569b09f562f282b5f31\"]}"
        }
      ]
    }
  ],
  "hash": "sha256:241a95f3bd15a1de04c6b7460fde4b9f26dea939511606bb7b94cc46a288e01c"
}
