{
  "schemaVersion": "1",
  "observationsHash": "sha256:72579fcd46894d490aee4d23e133eb4bdd94cb8cf9a1ed7035ea1ca275d77807",
  "builderHash": "sha256:470d14ce147c9a78666ae51a50697d887ddb4fdc270c4a9d6c9a56e227e58494",
  "role": "present",
  "records": [
    {
      "unitId": "u1",
      "cutoff": 2,
      "events": [
        {
          "time": 2,
          "value": "a"
        }
      ]
    },
    {
      "unitId": "u2",
      "cutoff": 2,
      "events": [
        {
          "time": 2,
          "value": "b"
        }
      ]
    },
    {
      "unitId": "u3",
      "cutoff": 2,
      "events": [
        {
          "time": 2,
          "value": "a"
        }
      ]
    },
    {
      "unitId": "u4",
      "cutoff": 2,
      "events": [
        {
          "time": 2,
          "value": "b"
        }
      ]
    },
    {
      "unitId": "u5",
      "cutoff": 2,
      "events": [
        {
          "time": 2,
          "value": "a"
        }
      ]
    },
    {
      "unitId": "u6",
      "cutoff": 2,
      "events": [
        {
          "time": 2,
          "value": "b"
        }
      ]
    },
    {
      "unitId": "u7",
      "cutoff": 2,
      "events": [
        {
          "time": 2,
          "value": "a"
        }
      ]
    },
    {
      "unitId": "u8",
      "cutoff": 2,
      "events": [
        {
          "time": 2,
          "value": "b"
        }
      ]
    }
  ],
  "hash": "sha256:ddfa1547b141b6d048a9e8b53fae30ce639cc64e5f563bfff019f44d30a97d81"
}
